A1: 2012年4月16日GPRS运营车辆在线统计表
A2: 路别 | B2: 责任人 | C2: 车辆（台） | D2: 在线车辆（台） | E2: 在线率 | F2: 不在线车辆（自编号） | G2: 原因
A3: 2路 | B3: 李永福 | C3: 28 | D3: 28 | E3: =D3/C3 -> 1
A4: 16路 | B4: 王新营 | C4: 20 | D4: 20 | E4: =D4/C4 -> 1
A5: 20路 | B5: 许爱国 | C5: 15 | D5: 14 | E5: =D5/C5 -> 0.93333333333333335 | F5: 2008(第1天） | G5: 修车
A6: 29路 | B6: 唐建峰 | C6: 22 | D6: 22 | E6: =D6/C6 -> 1
A7: 32路 | B7: 刘旭 | C7: 10 | D7: 10 | E7: =D7/C7 -> 1
A8: 66路 | B8: 张伟 | C8: 20 | D8: 18 | E8: =D8/C8 -> 0.9 | F8: 6602（第19天）、6617 | G8: 离合器待料、待料
A9: 68路 | B9: 高红涛 | C9: 20 | D9: 20 | E9: =D9/C9 -> 1
A10: 67路 | B10: 刘宽利 | C10: 20 | D10: 19 | E10: =D10/C10 -> 0.95 | F10: 6705 | G10: 车辆保养
A11: 39路 | B11: 徐栋栋 | C11: 18 | D11: 17 | E11: =D11/C11 -> 0.94444444444444442 | F11: 3908 | G11: 事故
A12: 7路 | B12: 李战功 | C12: 15 | D12: 14 | E12: =D12/C12 -> 0.93333333333333335 | F12: 708(第3天） | G12: 维修机油泵
A13: 27路 | B13: 程学铭 | C13: 18 | D13: 16 | E13: =D13/C13 -> 0.88888888888888884 | F13: 2701（第5天)、2703（第10天） | G13: 修电瓶、离合器片子待料
A14: 31路 | B14: 张洪峰 | C14: 15 | D14: 15 | E14: =D14/C14 -> 1
A15: 36路 | B15: 王新营 | C15: 7 | D15: 7 | E15: =D15/C15 -> 1
A16: 37路 | B16: 刘旭 | C16: 10 | D16: 10 | E16: =D16/C16 -> 1
A17: 38路 | B17: 王新营 | C17: 8 | D17: 8 | E17: =D17/C17 -> 1